{
  "$schema": "../../packages/plugin-schema/schemas/plugin.schema.json",
  "id": "tiny-pool",
  "name": "Tiny Pool",
  "version": "0.1.0",
  "kind": "system",
  "coreApi": "^0.1.0",
  "description": "A dice-pool system with Fate dice and success counting. No code.",
  "author": "VTT contributors",
  "license": "MIT",
  "hasCode": false,
  "locales": ["en"],
  "defaultLocale": "en"
}
