{
  "$schema": "../../packages/plugin-schema/schemas/plugin.schema.json",
  "id": "tiny-d20",
  "name": "Tiny D20",
  "version": "0.1.0",
  "kind": "system",
  "coreApi": "^0.1.0",
  "description": "A small d20 system: abilities, skills, hit points with a bar, and a skill roll.",
  "author": "VTT contributors",
  "license": "MIT",
  "hasCode": true,
  "locales": ["en", "pt-BR"],
  "defaultLocale": "en"
}
